{
  "schema_version": 1,
  "subagent_run_id": "wave6-019fef29-implementation-worker",
  "parent_run_id": "20260811-124437-JST",
  "agent": {
    "name": "implementation_worker",
    "model": "gpt-5.6-luna"
  },
  "role": "implementation_worker",
  "mode": "writable",
  "purpose": "Write Parallel Capability Gate UNKNOWN時のserial fallbackでfocused validation契約を確認する。",
  "sandbox": {
    "type": "workspace-write",
    "network": false
  },
  "allowed_files": [
    ".codex/agents/implementation_worker.toml"
  ],
  "input_files": [
    ".codex/agents/implementation_worker.toml"
  ],
  "changed_files": [],
  "scope": {
    "declared": true,
    "compliant": true,
    "violations": []
  },
  "started_at": null,
  "ended_at": null,
  "status": "completed",
  "summary": "Gate UNKNOWNによりserial実行。focused validation契約を確認し、変更・Git mutation・追加spawnなし。",
  "parent_decision": {
    "action": "accepted",
    "reason": "workspace isolationとchanged-file attributionを直接証明できないためparallel writeを許可せず、serial fallbackを採用した。"
  },
  "used_in_final_plan": true,
  "evidence": [
    {
      "kind": "path",
      "value": ".codex/agents/implementation_worker.toml"
    },
    {
      "kind": "finding",
      "value": "completion_status=completed; changed_files=[]; mutation_observed=no"
    }
  ],
  "metadata": {
    "runtime_agent_id": "019fef29-6972-7a33-b039-29a24e0fb124",
    "model_evidence": "custom-agent role configuration; SubagentStart hook was not observed for this run",
    "reasoning_effort_evidence": "not directly observed"
  }
}
