{
  "schema_version": 1,
  "subagent_run_id": "019ff0c8-ec38-75e2-bd3c-a945a6237b72",
  "parent_run_id": "20260811-200537-JST",
  "agent": {
    "name": "code_researcher",
    "model": "gpt-5.6-luna"
  },
  "role": "investigator",
  "mode": "read_only",
  "purpose": "Runtime Acceptanceにおけるコード調査Agentの起動・完了・identityを確認する。",
  "sandbox": {
    "type": "read-only",
    "network": false
  },
  "allowed_files": [],
  "input_files": [],
  "changed_files": [],
  "scope": {
    "declared": true,
    "compliant": true,
    "violations": []
  },
  "started_at": "2026-08-11T12:25:36Z",
  "ended_at": "2026-08-11T12:25:51Z",
  "status": "completed",
  "summary": "Hookがcode_researcherのStartとStopを同一runtime_agent_id・modelで観測し、Parent出力もcompletedを報告した。",
  "parent_decision": {
    "action": "accepted",
    "reason": "Runtime hookとParentのjoin結果が一致し、変更ファイルは空だった。"
  },
  "used_in_final_plan": true,
  "evidence": [
    {
      "kind": "path",
      "value": ".codex/runs/20260811-200537-JST/logs/hooks.jsonl"
    },
    {
      "kind": "validation",
      "value": "SubagentStart/SubagentStop、agent_id、model、completion_status=completedを確認した。"
    }
  ],
  "metadata": {
    "runtime_agent_id": "019ff0c8-ec38-75e2-bd3c-a945a6237b72",
    "session_id": "019ff0c8-9b74-7103-a814-9d4449d24b09",
    "turn_id": "019ff0c8-ece5-7261-813c-6e64e4c7a77b",
    "runtime_observed": true,
    "mutation_observed": "unknown"
  }
}
