{
  "schema_version": 1,
  "subagent_run_id": "019ff0c7-11fa-7530-bb75-23d427aa5928",
  "parent_run_id": "20260811-200537-JST",
  "agent": {
    "name": "implementation_researcher",
    "model": "gpt-5.6-luna"
  },
  "role": "investigator",
  "mode": "read_only",
  "purpose": "Runtime Acceptanceの初回短縮試行で実装調査Agentの起動・完了・identityを確認する。",
  "sandbox": {
    "type": "read-only",
    "network": false
  },
  "allowed_files": [],
  "input_files": [],
  "changed_files": [],
  "scope": {
    "declared": true,
    "compliant": true,
    "violations": []
  },
  "started_at": "2026-08-11T12:23:36Z",
  "ended_at": "2026-08-11T12:23:51Z",
  "status": "completed",
  "summary": "Hookがimplementation_researcherのStartとStopを同一runtime_agent_id・modelで観測し、Parent出力もcompletedを報告した。",
  "parent_decision": {
    "action": "accepted",
    "reason": "初回短縮試行のruntime identityと完了状態を記録した。"
  },
  "used_in_final_plan": true,
  "evidence": [
    {
      "kind": "path",
      "value": ".codex/runs/20260811-200537-JST/logs/hooks.jsonl"
    },
    {
      "kind": "validation",
      "value": "SubagentStart/SubagentStop、agent_id、model、completion_status=completedを確認した。"
    }
  ],
  "metadata": {
    "runtime_agent_id": "019ff0c7-11fa-7530-bb75-23d427aa5928",
    "session_id": "019ff0c6-8f1c-72c3-8ac6-47ff92619b64",
    "turn_id": "019ff0c7-1399-7bc2-a80b-193970545c10",
    "runtime_observed": true,
    "mutation_observed": "unknown"
  }
}
