{
  "schema_version": 1,
  "subagent_run_id": "f77c4a3d-a352-452a-95ae-5b2df989a845",
  "parent_run_id": "20260812-070120-JST",
  "agent": {"name": "test_investigator", "model": "gpt-5.6-luna"},
  "role": "investigator",
  "mode": "read_only",
  "purpose": "契約テスト、quality runner、recursion negative、sanitizerの検証観点調査",
  "sandbox": {"type": "read-only", "network": false},
  "allowed_files": [],
  "input_files": [],
  "changed_files": [],
  "scope": {"declared": true, "compliant": true, "violations": []},
  "started_at": "2026-08-11T22:08:00.059403Z",
  "ended_at": "2026-08-11T22:36:41.5545345Z",
  "status": "completed",
  "summary": "16件のPython契約テストは通過。実quality runner、実runtime recursion、sanitizer Write/Check、dirty fixtureの不足を報告した。",
  "parent_decision": {"action": "accepted", "reason": "未達ゲートと最終検証順序の根拠として採用した。"},
  "used_in_final_plan": true,
  "evidence": [
    {"kind": "path", "value": "scripts/test-luna-orchestration-contract.py"},
    {"kind": "path", "value": "scripts/sanitize-codex-artifacts.ps1"},
    {"kind": "summary", "value": "sanitizer Checkの残存2件はRun REPORTの絶対パスが原因と報告した。"}
  ],
  "metadata": {"runtime_agent_id": "019ff2de-7aa0-7ae0-8562-3d96db7d8ae4", "invocation_id": "f77c4a3d-a352-452a-95ae-5b2df989a845", "read_only_observed": true}
}
