{
  "schema_version": 1,
  "subagent_run_id": "019ff0cf-629d-74f1-af11-d753ef192df7",
  "parent_run_id": "20260811-200537-JST",
  "agent": {
    "name": "quality_gate_runner",
    "model": "gpt-5.6-luna"
  },
  "role": "quality_gate_runner",
  "mode": "writable",
  "purpose": "Parent-defined Local Required Validation Setを指定順で一度だけ実行し、Source Integrityと最初の異常を報告する。",
  "sandbox": {
    "type": "workspace-write",
    "network": false
  },
  "allowed_files": [
    ".artifacts/luna-orchestration/pr20-quality-runner-2148/**"
  ],
  "input_files": [],
  "changed_files": [],
  "scope": {
    "declared": true,
    "compliant": true,
    "violations": []
  },
  "started_at": "2026-08-11T12:32:37Z",
  "ended_at": "2026-08-11T12:34:44Z",
  "status": "failed",
  "summary": "5コマンドを指定順に各1回実行したが、Pythonとpnpmがchild環境のPATHに存在せず、BashはE_ACCESSDENIED、PowerShell verifyはPython未検出で失敗した。quality_gate_runnerはQUALITY_GATE_RUNNER_INCOMPLETEを返した。",
  "parent_decision": {
    "action": "deferred",
    "reason": "required validationの実行環境不備を原因候補として記録し、外側のhost gateで再確認する。未実行・失敗をPASSへ補完しない。"
  },
  "used_in_final_plan": true,
  "evidence": [
    {
      "kind": "path",
      "value": ".artifacts/luna-orchestration/pr20-quality-runner-2148/codex-output.txt"
    },
    {
      "kind": "validation",
      "value": "1 python=exit 1、2 bash=exit 1、3 PowerShell verify=exit 1、4 pnpm verify=exit 1、5 pnpm test:contracts=exit 1。"
    },
    {
      "kind": "finding",
      "value": "最初の異常はpythonのPATH未検出。PowerShell verifyではPython未検出とcodex-safeログAdd-ContentのAccess Deniedも観測された。"
    }
  ],
  "metadata": {
    "runtime_agent_id": "019ff0cf-629d-74f1-af11-d753ef192df7",
    "session_id": "019ff0ce-ccc2-7802-a896-36f0e21dead1",
    "turn_id": "019ff0cf-6349-79a1-9beb-3a52396e6618",
    "runtime_observed": true,
    "write_attempt_observed": true,
    "write_attempt_target": ".codex/logs/codex-safe-20260811.jsonl",
    "write_attempt_observability": "independent_error_observed",
    "source_integrity": "no_unexpected_source_delta_observed_by_outer_snapshot_pending"
  }
}
