{
  "schema_version": 1,
  "subagent_run_id": "403fba9e-6c14-43d7-a3f6-c2d663cae97c",
  "parent_run_id": "20260812-070120-JST",
  "agent": {"name": "implementation_researcher", "model": "gpt-5.6-luna"},
  "role": "investigator",
  "mode": "read_only",
  "purpose": "PR #20 の実装差分、verify、schema、dispatcherの影響範囲調査",
  "sandbox": {"type": "read-only", "network": false},
  "allowed_files": [],
  "input_files": [],
  "changed_files": [],
  "scope": {"declared": true, "compliant": true, "violations": []},
  "started_at": "2026-08-11T22:07:59.928398Z",
  "ended_at": "2026-08-11T22:36:41.5545345Z",
  "status": "completed",
  "summary": "dispatcherの余分な引数拒否、verifyのファイル存在順、PowerShell recursion marker、evaluation schema 3ケースを追加確認事項として報告した。",
  "parent_decision": {"action": "accepted", "reason": "verify markerとdocs/schema整合性の修正判断に採用した。"},
  "used_in_final_plan": true,
  "evidence": [
    {"kind": "path", "value": "scripts/codex-local-validation.mjs"},
    {"kind": "path", "value": "scripts/verify.ps1"},
    {"kind": "summary", "value": "dispatcher extra argumentは拒否されるが、policy exact argv形式は未確認と報告した。"}
  ],
  "metadata": {"runtime_agent_id": "019ff2de-771e-7cd3-a40f-9574a96adb95", "invocation_id": "403fba9e-6c14-43d7-a3f6-c2d663cae97c", "read_only_observed": true}
}
